name,description
Comedy‑Drama,"Combines comedic elements with dramatic storytelling, balancing humor and serious themes."
Romance‑Drama,"Focuses on romantic relationships within a dramatic narrative, exploring love and emotional conflicts."
Psychological Thriller,"Emphasizes the mental states of characters to create suspense, tension, and mind games."
Biographical Drama,"Dramatizes the life of a real person, blending factual events with narrative storytelling."
Drama‑Romance,"Dramatic narrative that places romantic relationships at its core, often exploring emotional depth."
Fantasy,"Features magical elements, supernatural phenomena, and imaginary worlds."
Crime Thriller,"Centers around criminal acts and investigations, building tension and suspense."
Drama,"Focuses on emotional and relational development of realistic characters facing conflicts."
